Link,Title,Location,Salary,Summary
https://kr.indeed.com/viewjob?jk=e6bc70cdfd686550,앰코테크놀로지코리아 각 부문 경력사원,앰코테크놀로지코리아 인천 연수구,,"하신 분 - (신입/경력) 전산 관련 전공하신 분 - (신입/경력) Python, C++ 중 1개 언어 이상 능력 보유하신 분 - (신입/경력) RF... 경력 우대 - Firmware, Python, C programing 경험..."
https://kr.indeed.com/viewjob?jk=917b28cee2d9a2ae,MBC 방송IT센터 소프트웨어 개발 담당,문화방송 서울 마포구,,"개발 경력 - C#/C++, python 개발자 - 개발경력 1년 이상 o... 통신·모바일·게임>응용프로그래머>C#|인터넷·IT·통신·모바일·게임>응용프로그래머> Python|인터넷·IT·통신·모바일·게임>웹프로그래머> Python"
https://kr.indeed.com/viewjob?jk=bd8e5afa35b65cbc,백엔드 개발자,스포카 대한민국,,들고 운영해 본 경험이 있는 분 단위 테스트 작성 등에 대해 거부감이 없고 습관이 잡혀 있는 분 우대 사항 Python 실무에서 3년 이상 사용한 경험이 있으신 분 컴퓨터과학 분야에서 논문 발표 실적이 있으신 분 마이크로서비...
https://kr.indeed.com/viewjob?jk=3955fd4c71248f19,Marketing Data Engineer,네오위즈 대한민국,,데이터의 특성을 잘 파악하여 주요지표 모니터링 시스템 구축 가능) 3. 소통 능력이 뛰어나신 분 1. Python 혹은 Bash script로 배치 스크립트 작성이 가능하신 분 (+a 배치에 대한 잠재적 오류사항을...
https://kr.indeed.com/viewjob?jk=6accdaa3b4a31fb6,"[청년 디지털 일자리] 어플리케이션, 소프트웨어 개발, 인공지능(AI),...",에이치엠 대구 동구,"월급 2,000,000원 - 2,200,000원",분석 알고리즘 개발 - 빅데이터 분석 능력(상관분석 등) - Data/Web Crawling 능력 - Python 기반 코딩 능력 [우대사항] - 정보처리기사 - 컴퓨터공학 관련 전공 상세모집요강 접수기간/방법 시작일...
https://kr.indeed.com/viewjob?jk=c087f1ba71ce09bc,"[동탄/판교] 신입,병특,경력 영상처리, 머신러닝 엔지니어",위키에이드 경기도 화성,,인터넷·IT·통신·모바일·게임>응용프로그래머>머신러닝(ML)|인터넷·IT·통신·모바일·게임>응용프로그래머> Python|인터넷·IT·통신·모바일·게임>응용프로그래머>C#|인터넷·IT·통신·모바일·게임>응용프로그래머>로봇지능개발...
https://kr.indeed.com/viewjob?jk=7d761bc97111609f,AI 데이터 수집 가공 업무,엠데이터싱크 용인 기흥구,"월급 2,000,000원 - 2,200,000원","성향을 지니신 분들에게 적합한 업무입니다. 그리고 AI에 대한 기본적인 업무와 배우려는 마음가짐만 있다면, python 이라는 쉬운 프로그래밍 언어를 통해 배우고 익히며 AI 산업의 전반적인 지식도 습득하 실 수 있을 것입니..."
https://kr.indeed.com/viewjob?jk=8e037dd1e6b237c1,IT서비스 개발 및 운영 - 프로그래머/3D디자이너/온라인마케터,아이티몰즈 전라북도 군산,"월급 2,000,000원 - 2,200,000원","야근, 술 강요 없음 아래와 같은 역량을 가지신 분을 찾습니다. - 프로그래머 - * 웹 개발자, 앱 개발자 * Python Django 사용자 우대 * Github, AWS PostgreSQL * 반응형 UI/UX 콘트롤..."
https://kr.indeed.com/viewjob?jk=2695294aea6dc3b6,MongoDB Engineer 모집,카카오 4.0 성남 판교역,,수 있는 분 Linux/Network에 대한 기초 지식이 있는 분 우대 사항 C/C++ 또는 Python 언어를 이용한 프로그램 개발(프로젝트) 경험이 있는 분 MongoDB 트러블 슈팅 경험이 있는 분 MongoDB...
https://kr.indeed.com/viewjob?jk=d1e75364ef505c68,"데이터 가치를 함께 발굴하실 머신러닝, 통계 모델링 전문가 모집",카카오 4.0 성남 판교역,,해당 기술에 자신감이 있으신 분도 환영합니다. 지원자격 머신 러닝/통계 등 모델링에 활용하는 언어( Python/Scala/R 등) 및 도구(Tensor flow/Pytorch 등)를 하나 이상 능숙하게 다룰 수 있으신...
https://kr.indeed.com/viewjob?jk=95ddf880e724ff1a,글로벌 소셜카지노 부문 사업PM,네오위즈 대한민국,,슬롯/블랙잭 등의 카지노 게임에 대한 이해도가 있으신 분 2. SQL 사용이 익숙하신 분 3. 엑셀/R/ Python을 활용해 통계 분석이 가능하신 분 4. 영어 활용 능력이 높으신 분 * 면접 일정 안내는 서류 합격...
https://kr.indeed.com/viewjob?jk=8c8700db243d1a3c,Applications Engineer (Library Character...,Synopsys 서울,,"Working knowledge of scripting languages like TCL, Unix Shell, Python, or Perl. Prior AE/design experience is a plus. Working..."
https://kr.indeed.com/viewjob?jk=638bbdc206107b6b,(주)풀무원 빅데이터팀장 모집,(주)풀무원 3.3 서울특별시,,"퓨터공학 우대) 경력: 12년 이상 필수요건 1) 빅데이터/AI 과제 수행, 기획 및 컨설팅 경력 2) R, Python 프로그램 개발 경력 및 데이터 마이닝, 최적화 등 수리 알고리즘 이해 및 개발 역량 3) 데이터 기반..."
https://kr.indeed.com/viewjob?jk=a3dfe9f46a85fe83,청년 디지털 일자리 참여 대상 [웹 개발자(Python) ],8퍼센트 서울 영등포구,"연봉 24,000,000원 - 60,000,000원",[직무내용] 1. 에잇퍼센트의 웹서비스 설계와 개발 - 은행의 기본 시스템을 만듭니다. 생각보다 돈을 받고 빌려주는 것은 쉽지 않습니다. 복잡한 DB 설계와 결함 없는 Transaction 관리를 필요로 합니다. - 다양한...
https://kr.indeed.com/viewjob?jk=c53e8bbdcd7076f2,[해외취업] 고급 IT 엔지니어,株式会社ASCOM 대한민국,,"일본어 능력은 상관없음.  python,C++,C,C#,ASP.net,JAVA,VB.net,swift,IOS,Android,kotlin 중 한가지 이상 개발 경력이 3년 이상인 자. [ python] * AI, 사물 인터넷..."
https://kr.indeed.com/viewjob?jk=5ed0334bca0963cb,[Autonomous Driving] Virtual Environment...,네이버 서울,,"C/C++, Software Design, Debugging Skills ㅇ 스크립트 언어 개발 경험 ( Python, Bash, etc) ㅇ Embedded Platform과 System Software 개발 경험 및 이해..."
https://kr.indeed.com/viewjob?jk=694ab958318e7fdc,RTL 및 ASIC 설계 엔지니어(딥러닝 하드웨어 프로세서 개발),딥엑스 성남 분당구,"연봉 40,000,000원 - 99,990,000원","모델의 RTL IP 설계 및 IP 검증 가능자 - Language: Python/Perl, C/C++ [우대 조건] - ARM based SoC 설계... 게임>빅데이터·AI(인공지능)> Python|인터넷·IT·통신·모바일·게임..."
https://kr.indeed.com/viewjob?jk=de7daa65f0e8403c,Associate Application Engineer - EBS,Siemens AG 4.0 경기도 성남,,Knowledge... programming language like Visual Basic or Python is also highly desirable. Organization: Digital Industries...
https://kr.indeed.com/viewjob?jk=9cc8068806968188,필드 서포트 엔지니어 (Software support),반도체 장비 (전공정) 경기도 수원,"연봉 35,000,000원 - 65,000,000원","CALL 및 고객대응 (경력) 2개 이상의 소프트웨어 개발 언어 사용 가능 ex) C++ , Java / Python, Object C 객체지향의 프로그래밍에 대한 이해 여부 소스 제어 사용 경험 유 ( GitHub..."
https://kr.indeed.com/viewjob?jk=f4190a8dbb8c05b1,[AI R&D] Language AI(NLP) Research 분야 수시...,엔씨소프트 2.7 성남 판교역,,"분 - 통계/Machine Learning에 대한 이해와 활용 능력 및 text 처리 기술에 대한 경험 - Python, Java 등을 이용하여 NLP 기술을 구현 가능한 분 - 최신 기술(논문, 기술문서 등)을 습득하는..."
https://kr.indeed.com/viewjob?jk=7e5d96b07d5edef0,머신러닝/딥러닝 연구 개발,NHN 4.4 성남 판교역,,"또는 개발 경력 2년 이상 - Python/C++/Java/C# 개발... 하기 위한 끊임 없는 열정과 호기심을 지닌 분 - C/C++, Python 등 개발 숙련자 [음성처리개발] Job Description 자격..."
https://kr.indeed.com/viewjob?jk=90f259dbd9f3c40a,인공지능(AI) 인력,신한에이아이 서울 영등포구,,"업공학 / 컴퓨터공학 / 통계 관련 [우대사항] - 프로그래밍 숙련자 ( python 外 C++, Java 등) - 금융데이터 또는 시계열 데이터 기반... 게임>빅데이터·AI(인공지능)> Python|인터넷·IT·통신·모바일·게임..."
https://kr.indeed.com/viewjob?jk=de567c4b6b588c4c,NAVER IDC 서버 운영/관리(춘천),NIT Service 춘천 동면,,"Web, WAS에 대한 지식과 System application 운영 경험 - Shell script, python 활용 가능 - 해외 데이터센터 인프라 구축 또는 운영 경험 - 국가보훈대상자 및 장애인은 법령에 의거 우대..."
https://kr.indeed.com/viewjob?jk=792d3ac05912a792,[아이콘트롤스] 2020년 경력 직원 (데이터분석),현대산업개발 3.0 대한민국,,"자격요건> - 경력: 경력 3년 이상 - 학력: 대졸 이상(컴퓨터공학 또는 관련 전공자) (필수) - Python을 이용한 데이터 분석 능력 보유자 (우대) - 시각화 툴(태블로, 파워BI, 클릭센스) 유경험자 - 스마트 홈..."
https://kr.indeed.com/viewjob?jk=097c35ed002a62e5,NAVER IDC 서버 운영/관리(평촌),NIT Service 안양 동안구,,"Web, WAS에 대한 지식과 System application 운영 경험 - Shell script, python 활용 가능 - 해외 데이터센터 인프라 구축 또는 운영 경험 - 국가보훈대상자 및 장애인은 법령에 의거 우대..."
https://kr.indeed.com/viewjob?jk=8fa4af60ecf0567f,Behavioral Scientist - South Korea,Barbaricum 경기도 평택,,"common statistical programming languages, including R, Python, STATA, SPSS, or SAS Experience in collecting and aggregating..."
https://kr.indeed.com/viewjob?jk=2388b862680cb1e1,침해분석대응 인력 모집,엔씨소프트 2.7 성남 판교역,,"다양한 시스템 하드닝 및 취약성 점검 경험 - 자동화 등 업무 중 필요한 기능을 직접 개발 (Java, Python 등) 경험 - 정보보안 관련 다양한 지식/기술 (서버, 네트워크, DB, 어플리케이션 등) 을 보유 - 침해..."
https://kr.indeed.com/viewjob?jk=36a418cd05c30a44,안드로이드 개발자,스포카 대한민국,,"합니다. 신기술 학습에 대한 열정 현재 스포카 크리에이터는 MSA기반의 서비스를 운영하고 있으며, 언어로는 Python, TypeScript, Rust, C#, Haskell, Kotlin 등 다양한 언어를 사용 중입니다..."
https://kr.indeed.com/viewjob?jk=20d40ee61adffeca,챗봇 플랫폼 개발자 모집,카카오 4.0 성남 판교역,,"서비스에 대한 두려움이 없으신 분 서버 개발 Java, Scala, Kotlin 등의 JVM 기반 언어 및 Python을 이용해서 실서비스 개발 및 운영해보신 분 데이터 엔지니어 Kafka, Elasticsearch..."
https://kr.indeed.com/viewjob?jk=810816c790317a08,보안,NHN 4.4 성남 판교역,,"보안 설계/적용/운영 경험 - Python, Script Language... 보안 위협 및 비정상 행위 분석 경험 - JAVA&Spring/ Python 개발 경력 3년 이상 - Linux 이론 지식 및 활용 경험..."
https://kr.indeed.com/viewjob?jk=d585814d097935eb,카카오톡 보이스톡/페이스톡/라이브톡 개발자 모집,카카오 4.0 성남 판교역,,"우대 사항 ✓ Spring/Java 혹은 Spring/Kotlin 기반 서버 개발 경험 ✓ MySQL, Python, JavaScript, Node.js 경험 ✓ 모바일/웹 환경을 위한 API 시스템 개발 경험 ✓ k8s..."
https://kr.indeed.com/viewjob?jk=b25ed61fb84a5785,프론트엔드 개발자,스포카 대한민국,,"적으로 TypeScript, React 및 Redux를 사용합니다. 사내 도구는 Rust와 Haskell, Python을 사용합니다. 제출 서류 이력서(필수), 포트폴리오/Github 주소(선택) 접수 기간 상시 채용(채용시 마감)"
https://kr.indeed.com/viewjob?jk=58613b11ebe8779c,Deep Learning R&D Engineer,Intel 4.1 서울,,TensorFlow and PyTorch - Strong programming skills with Python Preferred Qualifications - Experience as a deep learning...
https://kr.indeed.com/viewjob?jk=7d14cfb6855c70e5,2020년 하반기 한화투자증권 신입사원 채용,한화그룹 4.2 서울,,"관련 전공자 또는 지식 보유자 - 금융 관련 자격 보유자(CFA, 국제 FRM 자격 우대) - C++/ Python 프로그래밍 능통자 - 디지털 신기술 학습 및 경험자(빅데이터, 머신러닝, 블록체인, 클라우드 등) - 외국어..."
https://kr.indeed.com/viewjob?jk=021703718563a5b3,"Python, MySQL 외 신입/경력 정규직, 계약직",카라멜라 광주 동구,,"- Python 활용 개발 경험 - 팀프로젝트 경험, 구성원들과의 원활한 커뮤... 약직 채용 모집부문 및 자격요건 담당업무 자격요건 인원 [담당업무] - Python 개발 - Django 개발 - Mongo DB 개발 - MySQL..."
https://kr.indeed.com/viewjob?jk=c7d674c1d5466ed2,지스트 블록체인인터넷경제연구센터 계약직(연구원),광주과학기술원 광주 북구,,록체인 개발 블록체인 하드포크 1) 4년제 대학 이상 졸업자 2) SW프로그래밍 제작 경험자 3) Python/C/Java/Go 프로그래밍 가능자 우대사항 ① 국가보훈대상자(취업보호대상자) 및 장애인은 관련 법령...
https://kr.indeed.com/viewjob?jk=09682af104f3eaac,2020년도 국비기술교육생,대한상공회의소 광주인력개발원 광주 광산구,,통신·모바일·게임>빅데이터·AI(인공지능)>머신러닝|인터넷·IT·통신·모바일·게임>빅데이터·AI(인공지능)> Python|인터넷·IT·통신·모바일·게임>빅데이터·AI(인공지능)>하둡(Hadoop)|인터넷·IT·통신·모바일·게임...
https://kr.indeed.com/viewjob?jk=3e80435be74cd28f,블록체인인터넷경제연구센터 위촉연구원,광주과학기술원 광주 북구,,업무) 지원자격 연구직 O명 블록체인 연구 및 프로그래밍 제작 1) SW프로그래밍 제작 경험자 2) Python/C/Java/Go 프로그래밍 가능자 3) 블록체인 개발 경험자 우대 4) 컴퓨터공학 및 컴퓨터사이...
https://kr.indeed.com/viewjob?jk=193bfe67eed05c31,Data Scientist,"Koniag, Inc. 대한민국",,"experience is desired Demonstrated proficiency with R or Python, and SQL to manipulate data and draw insights from large..."
https://kr.indeed.com/viewjob?jk=a7c68eba65a950aa,지스트 블록체인경제센터 계약직연구원,광주과학기술원 광주 북구,,구직 1명 블록체인 개발 블록체인 경제 블록체인 하드포크 1) SW프로그래밍 제작 경험자 2) Python/C/Java/Go 프로그래밍 가능자 우대사항 ① 국가보훈대상자(취업보호대상자) 및 장애인은 관련 법령...
https://kr.indeed.com/viewjob?jk=5659585cce1dacc7,[정보보안] 보안기반 분석 개발 담당 모집,엔씨소프트 2.7 성남 판교역,,"보안시스템의 성능개선 및 관리 지원자격 학력 : 무관 경력기간 : 2년 ~ 10년 필수조건 - Java, Python 프로그래밍 언어로 개발이 가능하며, 오픈소스를 활용한 개발이 가능한 분 - 인프라, 운영업무 자동화 시스..."
https://kr.indeed.com/viewjob?jk=7b314f7d2a99c2ea,지스트 블록체인인터넷경제연구센터 계약직(박사급 연구원),광주과학기술원 광주 북구,,"기획 블록체인 연구·개발·하드포크 1) 박사 이상 졸업자 2) SW프로그래밍 제작 경험자 3) Python/C/Java/Go 프로그래밍 가능자 1명 시간제 (주20시간) (월-목, am10-pm4) 우대사항..."
https://kr.indeed.com/viewjob?jk=55a19c92c845685e,Developer / Designer recruit,마이뮤직테이스트 서울 논현동,,"language (i.e Python, Ruby, Java, .Net... High proficiency in Python... knowledge... least one Python web framework..."
https://kr.indeed.com/viewjob?jk=67503f27b0365593,인간중심 지능형 시스템 연구실 시간제 연구원,광주과학기술원 광주 북구,,"우대사항 ① 국가보훈대상자(취업보호대상자) 및 장애인은 관련 법령에 의거하여 우대 ② 이외 개발언어 ( Python, C++, JAVA, MFC, QT 등) 기반 SW(앱/웹 포함) 개발 가능자 ③ 인간대상연구 경험자..."
https://kr.indeed.com/viewjob?jk=77d8e0149dad533b,블록체인인터넷경제 연구센터 위촉연구원,광주과학기술원 광주 북구,,구직 명 블록체인 개발 블록체인 경제 블록체인 하드포크 1) SW프로그래밍 제작 경험자 2) Python/C/Java/Go 프로그래밍 가능자 우대사항 ① 국가보훈대상자(취업보호대상자) 및 장애인은 관련 법령...
https://kr.indeed.com/viewjob?jk=dfcb86f156623e5c,보훈대상자 인재 채용,네오위즈 대한민국,,경험이 있는 분 - Unix(Linux) / Windows Script 작성 능력을 갖춘 분 - Java / python 개발 능력을 보유한 분 모바일게임 UA마케팅 담당자 (경력) 경력 [담당업무] - 권역별 시장...
https://kr.indeed.com/viewjob?jk=dce61175d82c2314,"[해외취업] 미국, Text IQ, Software Engineer",Text IQ 대한민국,,"programming language: Java, C#, C++ or Python Ability to consistently deliver... Unix and scripting on Python Experience..."
https://kr.indeed.com/viewjob?jk=cdc69e78bbccefd3,[해외취업] AI 엔지니어,株式会社ASCOM 대한민국,,"회사에서 일하고 싶어하는 사람들에게 좋은 기회입니다. 인생의 새로운 장을 열어보세요! 1) C/C++, Python 및 기타 프로그래밍 언어에 익숙한 자 2) 딥 러닝 도구(예:Tensorflow,Caffe 등)에 익숙한 자..."
https://kr.indeed.com/viewjob?jk=9a9e91ae6092ed2d,Developers,Coinplug 경기도 성남,,"development and operation Experience using Java / Node.js / Go / Python, etc. Ability to utilize Databases including RDB..."
https://kr.indeed.com/viewjob?jk=9040dba1c8db2a5d,퀀트운용팀 (사원-대리급),신한비엔피파리바자산운용 대한민국,,지식 보유자 - 투자자산운용사 자격증 소지자 우대 - CFA/CAIA/CPA 자격증 소지자 우대 - VBA/ Python 활용한 업무 가능자 우대 - 관련 전공 및 석박사 학위/금융 관련 자격증 보유자 우대 3. 전형방법...
https://kr.indeed.com/viewjob?jk=a41d35173ffe4666,[Search] [Vision] Computer Vision Engine...,네이버 서울,,"스템 엔지니어링 · 스마트렌즈 , 이미지 / 동영상 검색 , 비주얼 커머스 서비스 고도화에 기여 [자격요건] · Python, C++, Golang, Scala 등의 백엔드 개발 언어를 1 개 이상 자유롭게 활용 가능한 분..."
https://kr.indeed.com/viewjob?jk=2485e93043545d8a,인간중심 지능형 시스템 연구실 위촉연구원,광주과학기술원 광주 북구,,"및 인간 대상 연구 수행) 공학 학사학위 이상 C#기반 SW개발 가능자 우대사항 ① 이외 개발언어 ( Python, C++, JAVA, MFC, QT 등) 기반 SW(앱/웹 포함) 개발 가능자 ② 인간대상연구 경험자..."
https://kr.indeed.com/viewjob?jk=eeb9fe1c361f0758,정보보안 담당자,Nexon 성남 분당구,,보안 이벤트 분석 또는 상관관계 이벤트 분석 능력 보유 - OS 및 네트워크 관련 기초 지식 보유 - python 등의 간단한 스크립트 작성 능력보유 - 타인과의 원활한 커뮤니케이션 자세 - 새로운 기술에 대한 적극적...
https://kr.indeed.com/viewjob?jk=674370fd38bce0dd,지스트 블록체인경제센터(강남소재) 계약직(연구원),광주과학기술원 광주 북구,,블록체인 경제 블록체인 하드포크 1) 4년대 대학 이상 졸업자 2) SW프로그래밍 제작 경험자 3) Python/C/Java/Go 프로그래밍 가능자 우대사항 ① 국가보훈대상자(취업보호대상자) 및 장애인은 관련 법령...
https://kr.indeed.com/viewjob?jk=3e2ccf374eae0c90,"[해외취업] 베리텍, 시스템개발자/응용프로그래머",에임하이글로벌 대한민국,"연봉 32,510,000원 - 65,030,000원","비지니스회화 주요업무내용 1. 개발자 : 시스템개발 업무 수행 및 유지보수 ( JAVA, C#,.Net, Python,PHP) 2. 응용프로그래머 : 솔루션 개발/운영(Web, C#, iOS, Android, Delphi..."
https://kr.indeed.com/viewjob?jk=7e9a745cd8bdcbe3,"Design Consultant, Staff",Synopsys 대한민국,,"industry DFT, MBIST, and ATPG tools •Experience scripting... Python and Tcl. Experience with Verilog or SystemVerilog RTL..."
https://kr.indeed.com/viewjob?jk=b8484108a7f4884f,"[해외취업] 누리누비, 시스템개발자/응용프로그래머",에임하이글로벌 대한민국,"연봉 32,520,000원 - 65,030,000원","백엔드 개발자' 의 경력사원이며, 상세업무내용은 아래와 같습니다. 1.개발자( JAVA, C#,.Net, Python,PHP): 시스템개발 업무 수행 및 유지보수 2.응용프로그래머: 솔루션 개발/운영(Web, C#, iOS..."
https://kr.indeed.com/viewjob?jk=05439002712f8135,차세대 광-무선 가입자망 연구센터 연구전담교수,광주과학기술원 광주 북구,,"분야 PCB Layout 및 제작 분야 -생체신호 관련 신호 분석 및 처리 실무 경험자 MATLAB, Python 등을 이용한 뇌신호 처리 및 분석 가능자 박사학위 소지자 우대사항 ① 국가보훈대상자(취업보호대상자..."
https://kr.indeed.com/viewjob?jk=fb617eeb80ea6fa9,AI/빅데이터/클라우드 분야 (인재 Pool),LG유플러스 3.8 서울,,"Science를 위한 언어(R/ Python) 및 Tool(scikit-learn/Tensorflow 등) 능숙자 . Deep Learning Model 구현 경험자 . Java, Python등을 이용하여 분석을 위한 Data..."
https://kr.indeed.com/viewjob?jk=06995d4800ce38f3,Field Application Engineer (FAE) – Korea...,LUCID Vision Labs 대한민국,,debugging technique (OpenCL... Python experience is a plus). In-depth knowledge... OpenCL... Python experience is a plus...
https://kr.indeed.com/viewjob?jk=d425b24146af3fa1,지구·환경공학부 환경시스템공학 연구실 위촉연구원,광주과학기술원 광주 북구,,"험수행 ① 국내외 4년제 대학교 환경공학관련분야 학사 이상 학위소지자로서, ② MATLAB, R, 그리고 Python 중 1개 이상의 프로그램 언어를 다룰 줄 알며, ③ 공고일 기준 2년 이내 아래의 공인영어성적 소지자..."
https://kr.indeed.com/viewjob?jk=8a9eab737d6e5fba,2020년 국내 석/박사 산학장학생,LG유플러스 3.8 서울,,"Hadoop, Hive, SQL 등 데이터 수집/가공 및 Java, python 등 개발 - 실시간 데이터 수집, 실시간 서비스 이용 현황 등 리얼타... 의미한 인사이트 발굴 - R, Python, SQL 등 Statistics..."
https://kr.indeed.com/viewjob?jk=e0bd768490336a11,"데이터마이닝, 데이터사이언스 신입 인턴",성공하는공장 서울 강남구,,"학과, 전산학, 컴퓨터공학과, 통계학 [우대사항] 전공계열: 인문과학계열, 공학계열 자격증: EXCEL, PYTHON, 컴퓨터활용능력 우대사항: 인근거주자 0 명 근무조건 고용형태: 인턴(근무기간 협의 후 결정, 수습기간 3..."
https://kr.indeed.com/viewjob?jk=4cd34228af5013fd,DGIST 2019년 제1차 계약직원 공개채용 공고,대구경북과학기술원 대구 현풍면,,"우수자(SPSS, R 등 통계패키지) 외국어(영어) 구사 능력 우수자 Programming(MATLAB, Python, C/C++ 등) 가능자 · 근무기간 : 2019.3.11.~2020.3.10. ※ 단, 재계약 평가에..."
https://kr.indeed.com/viewjob?jk=7453bfdc26273cd9,Quantitative Researcher,자산운용: Quantitative Research 서울,"연봉 110,000,000원 - 140,000,000원","깊은 사고력, 창의력, 직업적 윤리의식, 끈기 있고 명석한 자가주도형 인재 프로그래밍 가능 (C++, Python 선호하나 필수는 아님) 글로벌 금융 시장에 대해 배우려는 강력한 의지 영어로 의사소통이 원활하신 분 (서면 및..."
https://kr.indeed.com/viewjob?jk=092d062a6faa7139,데이터 분석가 모집,카카오 4.0 성남 판교역,,"이터 분석 지원자격 데이터 분석 업무를 수행할 수 있는 하나 이상의 언어 스킬 필수 (예. SQL, Python, R 등) 데이터 기반 프로젝트 경험이 있으신 분 (예: 통계 분석 프로젝트) 어떤 일이라도 중요하게 여기..."
https://kr.indeed.com/viewjob?jk=78d1ec77f4a5e0dc,기후 분석&모델링연구실 시간제연구원,광주과학기술원 광주 북구,,"수행 ① 국내외 4년제 대학교 환경공학관련분야 학사 이상 학위소지자로서, ② Fortran, GrADS, python 중 1개 이상의 프로그램 언어 사용 가능자 우대사항 ① 국가보훈대상자(취업보호대상자) 및 장애인은..."
https://kr.indeed.com/viewjob?jk=665e5885dfd75df4,[카카오커머스] 기술직군,카카오커머스 성남 분당구,,"Keras, Pytorch 등) ㆍ Python을 활용한 머신러닝/딥러닝... 이상 사용 경험이 있으신 분 ㆍ프로그램 개발(Java, Scale, Python 등) 중급 이상 기술 보유하신 분 ㆍ대용량 데이터에 대한 실시간/배치..."
https://kr.indeed.com/viewjob?jk=ce6747e77c861c46,Data Scientist,Boston Consulting Group 4.2 서울,,"analysis a plus, Programming... scripting exp.: eg. Python, C#, VBA, Java, Perl, etc. Experience in applied analytics..."
https://kr.indeed.com/viewjob?jk=45c829a2e15da0f9,[네이버웹툰] 데이터 분석 인턴 (체험형),네이버 서울,,"통계 , 컴퓨터공학 등 관련 전공 석사 이상 재학중인 분 - 데이터 분석 관련 인턴 업무를 경험해보신 분 - Python/R 등을 이용한 데이터 분석 업무가 가능하신 분 - 데이터를 통해 비즈니스 / 일상의 문제를 분석하고..."
https://kr.indeed.com/viewjob?jk=794e209e405f4fc0,지스트 블록체인경제센터(강남소재) 계약직연구원,광주과학기술원 광주 북구,,구직 명 블록체인 개발 블록체인 경제 블록체인 하드포크 1) SW프로그래밍 제작 경험자 2) Python/C/Java/Go 프로그래밍 가능자 우대사항 ① 국가보훈대상자(취업보호대상자) 및 장애인은 관련 법령...
