Link,Title,Location,Salary,Summary
https://kr.indeed.com/viewjob?jk=493a39e613f9971a,영상보안 Application 개발 및 수행,Success Korea 서울 중구,,"험자 - 영상 플레이어 개발경험 - CUDA(GPGPU) 개발 경험자 - Python 개발 경험자 - 인공지능 딥러닝, 빅데이터 관심있는 자 - 공공... GPGPU) 개발 경험자 - Python 개발 경험자 - 인공지능 딥러닝..."
https://kr.indeed.com/viewjob?jk=95ae961117610c26,Business Intelligence Manager,Success Korea 서울,,"분석, A/B test 등 분석 업무 수행 경험 -MySQL, R, Python 등을 통한 데이터 분석 경험 있으신 분 우대 -영어로 커뮤니케이션이... 수행 경험 -MySQL, R, Python 등을 통한 데이터 분석 경험..."
https://kr.indeed.com/viewjob?jk=5467f1fc45de3a63,[Artist] Technical Artist - FIFA,Success Korea 서울 강남구,,"script, Mel Script중 1) 사용 경험 - C# 또는 Python 언어에 대한 이해 및 활용 - 아트웍 관련 툴 제작 또는 플러그인 제작... 중 1) 사용 경험 - C# 또는 Python 언어에 대한 이해 및 활용..."
https://kr.indeed.com/viewjob?jk=8461bfe74b0948cf,SW 품질 보증 전문가,Success Korea 서울,,Fortify 룰셋 및 표준 수립 경험자 - Java 또는 Python 이용하여 대시보드 등의 개발이 가능자 [전형절차] 서류-면접 [제출서류... 수립 경험자 - Java 또는 Python 이용하여 대시보드 등의 개발이...
https://kr.indeed.com/viewjob?jk=de242c6c5e9207a9,응용프로그래머[JAVA],Success Korea 서울 성수동,,"SQL 개발 경험 필수 [우대사항] - Flex 개발 가능자 - C#, Python 언어 사용 가능자 - HTTP 기반의 통신(XML,JSon 데이터... Flex 개발 가능자 - C#, Python 언어 사용 가능자 - HTTP..."
https://kr.indeed.com/viewjob?jk=a3f7e859f78c3856,게임플랫폼 Server 개발,Success Korea 경기도 성남,,"scala (이외 C++, Go, Python 등)를 이용한 서버 개발... 사용) 자격요건 - Java / scala (이외 C++, Go, Python 등)를 이용한 서버 개발 경력 3년 이상 - 오픈소스 기술을 바탕..."
https://kr.indeed.com/viewjob?jk=e07bf0c08b59ca0c,Javascript Developer,Success Korea 서울,,"Cross-brower Scripting 및 Markup 가능하신 분 -git 사용하실 수 있는 분 - Python, PHP 등의 코드를 이해하실 수 있는 분 [젼형절차] 서류전형- 코딩테스트- 대면면접(1~2회)- 채용..."
https://kr.indeed.com/viewjob?jk=57eeb0cd4196cbe4,기술적 진단/침해분석 (대리~과장),Success Korea 서울,,"니어링, Digital Forensic 경험자 우대 - C, Java, Python 프로그래밍, CISA, CISSP, SIS, PMP 자격증 우대... 우대 - C, Java, Python 프로그래밍, CISA, CISSP..."
https://kr.indeed.com/viewjob?jk=1798869dfd2c3014,IP/MPLS 개발자,Success Korea 성남 판교역,,있어야 할 것 - C++ 및 Python 을 프로그래밍이 가능하면 선호됨... C 는 5 년 이상의 경력을 가지고 있어야 할 것 - C++ 및 Python 을 프로그래밍이 가능하면 선호됨 - Broadcom Switching...
https://kr.indeed.com/viewjob?jk=0ec5b648329eb0eb,Data Analyst (3년 이상),Success Korea 서울,,"를 통해 온/오프라인상에서 새로운 고객경험을 실험하고, 확산하는 것에 관심과 열정이 있으신 분 - SQL, Python, R 등 프로그래밍 언어 또는 데이터 분석 언어 1개 이상에 능숙하신 분 - Data Mining 및..."
https://kr.indeed.com/viewjob?jk=989584aa51f96aa1,SW개발(3명),Success Korea 서울 삼성동,,"++, C # 중 하나의 개발언어 능숙자 - Javascript, Python, PHP, Ruby, Perl, Delphi중 하나도 가능한 분 우대... 능숙자 - Javascript, Python, PHP, Ruby, Perl..."
https://kr.indeed.com/viewjob?jk=a72ab5e8773b9ad8,빅데이터 개발(3년이상 경력),에이치알 코리아 서울,,"자격 - JAVA/ Python/Scala 등 활용한 데이터분석/설계/개발 역량 - DB 설계/개발 역량 - 빅데이터(Hadoop Eco) 기반 DW/DM Architecture 수립 경험 보유자 - Python, Hadoop..."
https://kr.indeed.com/viewjob?jk=ba3e218f3dfb8be7,Security Developer,Success Korea 서울 삼성동,,"요건] - 보안 취약점 점검 관련 경력 5년이상 - Java, PHP, Python 등의 언어로 프로그램 개발 필수 - IT인프라에 대한 지식 보유자... 년이상 - Java, PHP, Python 등의 언어로 프로그램 개발 필수..."
https://kr.indeed.com/viewjob?jk=cb0a416e54b80e41,Cloud System Engineer (3년이상),Success Korea 서울,,"및 운영 경험 - SRE(Site reliability Engineers) 경험 - 스크립팅 역량 보유 ( Python, Go, Shellscript 등) - Terraform, Ansible, SaltStack, CDK 구축..."
https://kr.indeed.com/viewjob?jk=c8869aca354714a1,Server Developer(PHP),Success Korea 서울,,"구축 및 스토리지 사용 경험 - APM 환경 서버 구축 경험자 - python, django,flask 관련 경험 우대 [전형절차] 서류전형- 1... APM 환경 서버 구축 경험자 - python, django,flask..."
https://kr.indeed.com/viewjob?jk=806b07d4b07e4c47,SW Architect,Success Korea 서울 신논현역,,"자격요건] - C#, JAVA, Python 등 OOP(Object... 임원면접 [제출서류] 국문이력서 자격요건 - C#, JAVA, Python 등 OOP(Object Oriented Programming) 언어..."
https://kr.indeed.com/viewjob?jk=6373005ce9ee17b0,cloud/saas개발,Success Korea 서울,,"발업무 경력 3년이상 -Node.js(java-script), SpringBoot(Java), Django( Python) 실무 경험 1년 이상 (최소 1개 이상) -RDB(Oracle, MySQL, Postgres 1개 이상..."
https://kr.indeed.com/viewjob?jk=a979e53aa387868c,보안개발자(ASAP),Success Korea 서울 삼성동,,"요건] - 보안 취약점 점검 관련 경력 5년이상 - Java, PHP, Python 등의 언어(택1)로 자동화프로그램 개발 가능한 분 - IT인프라에... 5년이상 - Java, PHP, Python 등의 언어(택1)로 자동화프로..."
https://kr.indeed.com/viewjob?jk=15c8fa49b690a9e5,포털 신규 검색기술 파일럿 개발(사원-차장),Success Korea 서울,,"결정 [자격요건] - JAVA, Python, R, JavaScript... 합격자에 한해 고객사 입사 지원서 오픈됨 자격요건 - JAVA, Python, R, JavaScript 등 최소 1개의 언어 이상 개발이 가능한..."
https://kr.indeed.com/viewjob?jk=220551aa57f5eed8,Technical Artist,Success Korea 서울 강남구,,"책임지는 역할 [자격요건] - Python, MEL 또는 Max script 같은 스크립트 언어 사용 경험 -PHOTOSHOP, MAYA 등의 아트웍툴 사용 [우대사항] -C# 또는 Python 언어에 대한 이해 및 활용..."
https://kr.indeed.com/viewjob?jk=d98bd89a9218a693,서버 시스템 or PHP 기반의 서버 엔지니어,Success Korea 서울 강남구,,"경험 - python, perl 등을 이용한 시스템 운영 스크립팅 경험 - 시스템 퍼포먼스 튜닝 경험 - OSS 기반의 소프트웨어 스택을 이용한 시스템 운영에 익숙하신 분 2. 서버 프로그래머 - PHP/ Python..."
https://kr.indeed.com/viewjob?jk=d04d5965fd332b3e,DW&BI팀 Data Architect,Success Korea 서울,,"BigQuery) - 데이터 표준 수립 및 관리 역량 - Java 또는 Python, Linux Shell 등의 코딩 능력 [우대사항] - 금융... 및 관리 역량 - Java 또는 Python, Linux Shell 등의..."
https://kr.indeed.com/viewjob?jk=4dc7b795d4e8efb8,[ASAP] 머신러닝 엔지니어 (10년차 이상 혹은 전후),Success Korea 서울,,"평가 및 개발, 적용 필수사항 : - PyTorch, Tensorflow 중 1개 이상 사용 가능 - Python 중급 이상 - Apache Spark 사용 가능 - 딥러닝 포함 머신러닝 관련 지식 보유 - 머신러닝 프로젝..."
https://kr.indeed.com/viewjob?jk=c3ea33eb7ad24308,Microsoft Azure Cloud Solution Architect,Success Korea 서울 논현동,,"포함 운영 및 구축 경험 경험자 우대 - 네트워크, 서버, 개발언어( Python,Java) 등 다양한 인프라 및 개발 환경 이해하고 있는 자 [전형... 네트워크, 서버, 개발언어( Python,Java) 등 다양한 인프라 및..."
https://kr.indeed.com/viewjob?jk=4e0b7f602fa05487,DevOps Developer(Cloud),Success Korea 서울 논현동,,"개발 경험 5년 이상 - .Net, Java, PHP, Node.js, Python, REST API 관련 이해도가 높은 자 - Cloud Web... Java, PHP, Node.js, Python, REST API 관련..."
https://kr.indeed.com/viewjob?jk=a758b91ea2f0dd2b,SW개발 매니저,Success Korea 서울 삼성동,,"++, C # 중 하나의 개발언어 능숙자 - Javascript, Python, PHP, Ruby, Perl, Delphi중 하나도 가능한 분 우대... 능숙자 - Javascript, Python, PHP, Ruby, Perl..."
https://kr.indeed.com/viewjob?jk=9a159041784041c1,플랫폼 백엔드 개발,Success Korea 서울,,"대용량 시스템 설계 및 개발 경력 - Java, Spring, Python 기반 Web Application 개발 및 운영 경력 - MongoDB... Java, Spring, Python 기반 Web Application..."
https://kr.indeed.com/viewjob?jk=71dfe9e7b0f2643b,고객데이터 분석,Success Korea 서울,,"Hive, Hadoop) 경험 - 데이터 기반으로 현업부서와의 원할한 커뮤니케이션 능력 우대사항 : - Python, R, 하둡, Spark 등 활용 가능자 - 통계 관련 또는 컴퓨터공학 관련 전공자 - Google..."
https://kr.indeed.com/viewjob?jk=417d3e24bac85b14,Analytics Engineer,Success Korea 서울 삼성동,,"경험 - 프로그래밍 언어 중 2가지 이상 능숙하게 사용(R, Scala, Python, Java) - Deep Learning 알고리즘 개발 및 활용... 이상 능숙하게 사용(R, Scala, Python, Java) - Deep..."
https://kr.indeed.com/viewjob?jk=311976c5906e5c25,웹/응용프로그래머[JAVA],Success Korea 서울 성수동,,"기반의 웹 UI 개발 경험 - SVN, RedMine 환경 - Python 언어 개발 가능자 우대 - CRM 개발 유경험자 우대 [전형절차] 서류전... SVN, RedMine 환경 - Python 언어 개발 가능자 우대..."
https://kr.indeed.com/viewjob?jk=6ef66bd841739a4b,[IT R&D] 머신러닝 개발 부문 (과장),Success Korea 서울 을지로동,,"머신러닝/딥러닝 소프트웨어에 대한 지식 * Java, C/C++, Python, LISP 등 프로그래밍 언어 전문 지식 및 개발 능력 보유 (머신러... 대한 지식 * Java, C/C++, Python, LISP 등 프로그래밍..."
https://kr.indeed.com/viewjob?jk=c4e7809eb035c7ee,웹개발팀장,Success Korea 서울 잠실역,,"이스, 카산드라등) 경험자 우대 - TDD 및 스크립트 언어(Ruby, Python, Javascript) 경험자 우대 [전형절차] 실무면접(테크면... 및 스크립트 언어(Ruby, Python, Javascript) 경험자..."
https://kr.indeed.com/viewjob?jk=75a1f925e5637e4d,Full Stack Senior 개발자,Success Korea 서울 강남구,,"반적인 부분에 대해 구축이 가능하신 분 - Java, Ruby, Python등의 개발언어에 능숙하신 분 - HTML5, CSS3, Javascript... 능하신 분 - Java, Ruby, Python등의 개발언어에 능숙하신 분..."
https://kr.indeed.com/viewjob?jk=648f85cf1a59df6f,응용프로그래머[JAVA]-PM,Success Korea 서울 성수동,,"JSon 데이터 처리) [우대사항] - Flex 개발 가능자 - C#, Python 언어 사용 가능자 [전형절차] 서류전형 > 임원면접 > 최종합격... Flex 개발 가능자 - C#, Python 언어 사용 가능자 [전형절차..."
https://kr.indeed.com/viewjob?jk=0f26fc885d7f30ee,고객데이터 분석 (3년이상),Success Korea 서울,,"사이언스 직무 경력 3년 이상 필수조건 : - 데이터 분석 및 모델링을 위한 분석 Tool 활용 능력 ( Python, R 등) - 대용량 데이터의 효율적 사용을 위한 빅데이터 분석 플랫폼 경험자 (Hadoop, Hive..."
https://kr.indeed.com/viewjob?jk=4075d8bfdc15d56d,Data Analyst (5년이상),Success Korea 서울,,"분석을 통한 인사이트 발굴 경험 - 데이터를 기반으로 현업부서와의 원할한 커뮤니케이션 능력 우대사항 : - Python, R, 하둡, Spark 등 활용 가능자 - 통계 관련 또는 컴퓨터공학 관련 전공자 - Google..."
https://kr.indeed.com/viewjob?jk=aa33fe7923668df4,Back-End 개발자 (거래소),Success Korea 서울 강남구,,"설계 및 기본튜닝, DB쿼리 개발 숙련자 - Gp, Java, C++, Python 등 PHP 이외의 개발언어를 능숙하게 다루는 자 - 정보처리기사... 련자 - Gp, Java, C++, Python 등 PHP 이외의 개발언어..."
https://kr.indeed.com/viewjob?jk=bf6d04be8ff513d2,전산팀 개발 담당,Success Korea 서울 역삼동,,"이상~ -학사 이상 / 남녀 무관 -기술요구사항: JAVA/WEB, PYTHON, ORACLE: ERP I/F API, CRAWLING 개발 [우대... 기술요구사항: JAVA/WEB, PYTHON, ORACLE: ERP I/F..."
https://kr.indeed.com/viewjob?jk=74c4f418a78c820f,데이터 전문가,Success Korea 서울 삼성동,,"경험 - 프로그래밍 언어 중 2가지 이상 능숙하게 사용(R, Scala, Python, Java) - 컴퓨터 사이언스 또는 통계 관련 박사학위자 우대... 능숙하게 사용(R, Scala, Python, Java) - 컴퓨터 사이언..."
https://kr.indeed.com/viewjob?jk=bc4a0e62c7c3d510,테크니컬 아키텍트,Success Korea 서울,,등 Configuration Management 경험 - Bash/ Python 등 서버 운영에 필요한 Script 중급 이상자 * 우대 사항... Management 경험 - Bash/ Python 등 서버 운영에 필요한...
https://kr.indeed.com/viewjob?jk=450cd18a140afa16,데이터 분석가,Success Korea 서울,,"4년 이상 - SAS, R, Python, SQL 중 두 개 이상의 분석... 력서 자격요건 - 데이터 분석 경력 4년 이상 - SAS, R, Python, SQL 중 두 개 이상의 분석 도구에 대한 높은 이해 - 통계 분석..."
https://kr.indeed.com/viewjob?jk=4fb135f4b8706402,머신러닝 엔지니어 (Machine Learning Engineer),Success Korea 서울,,"평가 및 개발, 적용 필수사항 : - PyTorch, Tensorflow 중 1개 이상 사용 가능 - Python 중급 이상 - Apache Spark 사용 가능 - 딥러닝 포함 머신러닝 관련 지식 보유 - 머신러..."
https://kr.indeed.com/viewjob?jk=d24428ed26f0b058,디지털LAB 신기술파트,국내자본 저축은행 서울 구로구,,"[담당업무] 쳇봇, STT/TA/TTS, AI 일반 [자격요건] 4년제 정규 대졸 이상 Java, Python 프로그램 사용 가능 머신러닝(Tensorflow, DL4, Caffe,Theano) 프레임워크 기반 개발 능력 보유..."
https://kr.indeed.com/viewjob?jk=caccb1d9be6bc918,운영(Business Operation Management) 경력자,유명메신저회사 서울 성동구,,"분 (특히 O2O나 모빌리티 분야) ? 데이터를 분석하고, 프로세스 개선에 적용할 수 있는 분(SQL, Python, R 등) [ 기타조건 ] - 경력 : 5년 이상 - 학력 : 대졸이상 - 채용조건 : 정규직 - 근무지..."
https://kr.indeed.com/viewjob?jk=0fd935a8c87c082e,20년 차량용 반도체/전장SW 전문가 경력 상시 [PT SW플랫폼 개발],현대오트론 서울 강남구,,"Ethernet, 엔진/변속기/하이브리드, 차량간 통신 등 차량 전장관련 경험·지식 · C/C++, JAVA, Python, Perl, Eclipse 등 언어 활용능력 · 영어 능통자 우대 서울 강남구 삼성동 지원조건 모집분..."
https://kr.indeed.com/viewjob?jk=cdf617324298bb9d,저축은행 소비자금융 Data Science 팀,국내자본 저축은행 서울 구로구,,"4년제 정규 대졸 이상 - 통계, 수학, 산업공학 전공자 (석사 이상 우대) - 통계프로그램(SAS, R, Python) 활용가능자 - 소비자금융 CSS모델링 관련 업무 경력 2년 이상 [전형절차] 서류, 면접 2회 [제출서..."
https://kr.indeed.com/viewjob?jk=2936adf2a7318db5,웹개발자,Success Korea 서울 잠실역,,"이스, 카산드라등) 경험자 우대 - TDD 및 스크립트 언어(Ruby, Python, Javascript) 경험자 우대 [전형절차] 실무면접(테크면... 및 스크립트 언어(Ruby, Python, Javascript) 경험자..."
https://kr.indeed.com/viewjob?jk=516545e5882be38c,시스템 엔지니어,Success Korea 서울 삼성동,,"을 도입하고 운영한 경험을 보유하신 분 - Shell, Perl, Python 중 1개 이상의 언어에 능숙하신 분 [전형절차] 서류전형-기술test... 분 - Shell, Perl, Python 중 1개 이상의 언어에 능숙하신..."
https://kr.indeed.com/viewjob?jk=30a73289957a9676,하둡 엔지니어 (긴급),Success Korea 서울 강남구,,"경험자 또는 운영 경력자 - Linux 사용 가능자(중급 이상) - python, java, spring 개발 경험자(중급 이상) - Database... 사용 가능자(중급 이상) - python, java, spring 개발..."
https://kr.indeed.com/viewjob?jk=1947d9fed6bf4e36,백엔드 개발자(리드),Success Korea 서울 역삼역,,"법인 업무내용/자격요건 담당직무 Backend 개발 (node.js, python) 서비스 백엔드 시스템 개발 및 고객 및 광고 데이터를 처리합니다... TypeScript, Python ? Node.js, Express..."
https://kr.indeed.com/viewjob?jk=6e2edb2a07654c30,Data Analyst,Success Korea 서울,,"데이터 분석 경력 최소 3년 이상(전 직급) - SAS, R, Python, SQL 중 두 개 이상의 분석 도구에 대한 이해 - 통계 분석 및... 전 직급) - SAS, R, Python, SQL 중 두 개 이상의 분석..."
https://kr.indeed.com/viewjob?jk=db4aea89adb14a66,데이터로직스 2020 개발PL 경력직,데이터로직스 서울 강남구,,니다. 인터넷·IT·통신·모바일·게임>응용프로그래머>JAVA|인터넷·IT·통신·모바일·게임>응용프로그래머> Python|인터넷·IT·통신·모바일·게임>웹프로그래머>JSP|인터넷·IT·통신·모바일·게임>데이터베이스·DBA>DBA...
https://kr.indeed.com/viewjob?jk=6863b8ecbee9cb28,Big Data Engineer,휴먼디지털 서울,,"DB, Network, Computer - Architect 관련 지식 보유자 - Shell script/ python/Java/MySQL - 활용 가능자 - 개발을 좋아하고 새로운 기술을 - 배움이 즐거운 자 - Front..."
https://kr.indeed.com/viewjob?jk=67e90e28e81d778d,데이터분석,Success Korea 서울,,고객분석/상품분석/추천/검색 관련 프로젝트 2개 이상의 경험 - R， Python， SQL 필수 [전형절차] 서류-면접 [제출서류] 국문이력서... 2개 이상의 경험 - R， Python， SQL 필수 [전형절차] 서류...
https://kr.indeed.com/viewjob?jk=e58c6fe6fd87f03e,Operations Associate (운영팀원) - 한국,Beam 서울,,"business content • Proficiency in SQL, Python, R, GIS is advantageous 자격요건 • 학사학위... 완전한 문서 번역 가능 • SQL, Python, R, GIS 숙련자 우대..."
https://kr.indeed.com/viewjob?jk=4f76e06ec22d352a,API설계/개발,Success Korea 서울 선릉역,,"이상 경험 - RDBMS SQL 중급 이상 - PHP, Python, GO, Java 언어 중 1개 이상 중급 [우대사항] - RESTful... SQL 중급 이상 - PHP, Python, GO, Java 언어 중 1..."
https://kr.indeed.com/viewjob?jk=509e7ab10e54f962,디지털마케팅본부 수신상품 기획 및 전략수립 경력자,국내자본 저축은행 서울,,"수립(채널별 고객맞춤별 상품개발) [자격요건] - 4년제 정규 대졸 이상 - 통계 프로그램(SAS, R, Python) 활용 가능자 - 상품기획 및 전략수립 경력 2년 이상 - 금융권 업무 경험자 [전형절차] 서류, 면접 2..."
https://kr.indeed.com/viewjob?jk=1b3b8333c9dae2ce,Quantitative Researcher,Success Korea 서울 종로구,,상의 학위를 취득하신 분이 유리함) - 코딩 가능하신 분(C++ or Python) - 영어에 능숙하신 분(모든 인터뷰 과정은 영어로 진행) - 경력... 코딩 가능하신 분(C++ or Python) - 영어에 능숙하신 분(모든...
https://kr.indeed.com/viewjob?jk=6f29b95e3fb173f5,그로스해킹/데이터분석 (5년이상),Success Korea 서울,,"데이터 분석과 마케팅자동화, 시각화, A/B Test 등 데이터 관련 Tool 활용 경험 (SQL, Python, R / Google Analytics, Appsflyer / Tableau, Kibana 등) - 대용량 데이..."
https://kr.indeed.com/viewjob?jk=e51c8736967894d3,TEST IT,Success Korea 인천 부평구,,"전문기업 업무내용/자격요건 자격요건 - 전산 관련 학과 전공하신 분 - C/C++/C#, JAVA, Python, Unix/Linux, MSSQL 경력있으신 분 - 오픈소스 활용, 빅데이터 플랫폼 구축 및 운영 경험있..."
https://kr.indeed.com/viewjob?jk=1686bc8fdc03fd84,빅데이터 분석/컨설팅(3년이상 경력),에이치알 코리아 서울,,"설팅 지원자격 - 빅데이터 분석역량 - 빅데이터, DW/CRM 프로젝트 PM/PMO 수행 경험 - PI / IT 전략 컨설팅 경험보유 우대 - R, Python, SAS,, SQL, Hive on Hadoop 사용경험 우대"
https://kr.indeed.com/viewjob?jk=4e4c0ded02e9efd4,모바일 RPG 게임,Success Korea 서울,,"자료구조, 알고리듬 사용 및 로직 구현에 능숙한 분 -C++, C#, Python 언어 중 하나를 능숙하게 사용 -새로운 언어, 환경에 대한 두려움이... 능숙한 분 -C++, C#, Python 언어 중 하나를 능숙하게 사용..."
https://kr.indeed.com/viewjob?jk=53ced11b1e0addce,저축은행 디지털뱅킹팀 데이터분석 경력,국내자본 저축은행 서울 구로구,,"고객 분석, 마케팅 분석 - 마케팅 기획 및 실행조직과 협업 경험, 마케팅 데이터 모델링 개발능력 - R, Python, Tableau, SAS, Orange, SQL 등 데이터 분석의 업무를 수행 할 수 있는 개발 언어에..."
https://kr.indeed.com/viewjob?jk=9cd311595b3e4bea,저축은행 소비자금융 Data Science,국내자본 저축은행 서울 구로구,,"분석 [자격요건] - 4년제 정규 대졸 이상 - 통계, 수학, 산업공학 전공자 - 통계프로그램(SAS, R, Python) 활용가능자 및 석사 이상 - 소비자금융 관련업 경력자 우대 [전형절차] 서류, 면접 2회 [제출서류..."
https://kr.indeed.com/viewjob?jk=12bca81588e3f9aa,응용프로그래머[팀장급],Success Korea 서울 성수동,,"Windows Server, MS-SQL 개발 경험 [우대사항] - Python 개발 가능자 우대 [전형절차] 서류전형 > 임원면접 > 최종합격... 개발 경험 [우대사항] - Python 개발 가능자 우대 [전형절차..."
https://kr.indeed.com/viewjob?jk=71ecd14b3431ac40,Cloud Platfrorm 개발 및 운영,Success Korea 성남 분당구,,"격요건] -OpenStack 에 대한 지식 및 경험이 풍부하신 분 - Python, Perl, PHP, Java 중 개발 경험이 있으신 분 -Linux... 지식 및 경험이 풍부하신 분 - Python, Perl, PHP, Java..."
https://kr.indeed.com/viewjob?jk=785844821918d4ac,"클라우드 서비스 개발자 중급(IaaS, PaaS)",SW개발전문회사 서울 마포구,,"서비스 API와 연계된 서비스를 개발 - 배포, 빌드, 테스트 자동화와 관련된 DevOps 개발 - Go, Python, JS(Angular/React) 등을 이용한 웹 애플리케이션 개발 [전형절차] 서류, 면접 2회 [제출..."
https://kr.indeed.com/viewjob?jk=4f434e03385f0b9c,Data Scientist,Success Korea 서울 강남구,,"이상 활용 능력 ? Python, R 외 기타 1개 이상의 데이터 분석 및 모델링 관련 컴퓨터 랭귀지에 대한 중급 이상 실력 ? 데이터 프로세싱을 위한 컴퓨터 랭귀지의 1개 이상 초급 이상 실력 ( Python, Shell..."
https://kr.indeed.com/viewjob?jk=f2862292f0a18038,Machine Learning Engineer (이미지기술개발),Success Korea 서울,,"설정 포함) 및 연동 경험 우대 - 비지니스 영어 회화 가능자 - 창의적 문제 해결 능력 보유자 - Python/JAVA 사용자, Andorid/iOS 개발 경험자, Windows Programing(C#, MFC 등..."
https://kr.indeed.com/viewjob?jk=e694ab3767521447,데이터 사이언스,Success Korea 서울 강남구,,"이상 활용 능력 - Python, R 외 기타 1개 이상의 데이터 분석 및 모델링 관련 컴퓨터 랭귀지에 대한 중급 이상 실력 - 데이터 프로세싱을 위한 컴퓨터 랭귀지의 1개 이상 초급 이상 실력 ( Python, Shell..."
https://kr.indeed.com/viewjob?jk=4801b7535e8bc40d,서버 개발(사원~과장급),Success Korea 서울 가산디지털단지역,,"회사소개 http... newemotion.co.kr 업무내용/자격요건 자격요건 - PHP, Python, Javascript - Mysql - OAuth - Amazon SQS - 대학교 수준의 알고리듬 / DB..."
https://kr.indeed.com/viewjob?jk=86a47dc8924f3275,AD Machine Learning Engine 개발,Success Korea 성남 분당구,,"수식을 보고 개발하는 것에 부담이 없으신 분 - Java, Python 외의 새로운 언어 사용에 부담이 없으신 분 - Hadoop, Spark... 부담이 없으신 분 - Java, Python 외의 새로운 언어 사용에 부담..."
https://kr.indeed.com/viewjob?jk=e9952107e4857eaf,Machine Learning Engineer (8년이상),Success Korea 서울,,"8년 이상 (딥러닝 관련 업무수행 3년이상 필수) 필수사항 : - Python 중급 이상 - PyTorch, Tensorflow 중 1개 이상 사용... 3년이상 필수) 필수사항 : - Python 중급 이상 - PyTorch..."
https://kr.indeed.com/viewjob?jk=a2089ff8a19a429f,Fullstack SW개발자,신재생에너지 분야 솔루션기업 성남 판교역,,"자격요건] -유관업무 경력 5년 이상 -Programmming Language : C/C++, Java, Python -데이터베이스 기초설계 및 연동 -웹기반 UI 개발 경험 [우대요건] -분산형 시스템 개발 경험 -AI..."
https://kr.indeed.com/viewjob?jk=62f4835c89011cd6,Discovery(검색/추천) ML Engineer,Success Korea 서울,,"신만의 방법론을 보유하신 분 [우대사항] 자연어 처리, 랭킹 로직 및 추천 알고리즘 개발 경험이 있으신 분 Python 또는 R 등의 데이터를 다루기 위한 언어를 1 개 이상 능숙하게 사용 가능하신 분 수학 및 통계 이론을..."
https://kr.indeed.com/viewjob?jk=145e4220a8244c4e,Machine Learning Engineer (5년이상),Success Korea 서울,,"5년 이상 (딥러닝 관련 업무수행 2년이상 필수) 필수사항 : - Python 중급 이상 - PyTorch, Tensorflow 중 1개 이상 사용... 2년이상 필수) 필수사항 : - Python 중급 이상 - PyTorch..."
https://kr.indeed.com/viewjob?jk=fdf1db98262a7014,Data Engineer,Success Korea 서울,,SQL 기반 데이터베이스 경험이 있는 분 -JavaScript / python 등 script 언어 숙련자 - AWS 기반 개발 경험자 (Azure... 있는 분 -JavaScript / python 등 script 언어 숙련자...
