Link,Title,Location,Salary,Summary
https://kr.indeed.com/viewjob?jk=7ab72b2f19e2425d,Back-end Engineer 경력 채용,주식회사 카사코리아 관심기업 서울 삼성동,,"클라이언트와 통신을 위한 API 설계 및 구현 [자격요건] - C++, JAVA, Node.js, Python, Go 중 하나 이상의 언어 능통자 - 프로덕션 환경에서 지속적인 서비스 개선 및 운영 경험 - 웹 기술 및..."
https://kr.indeed.com/viewjob?jk=3383326062c40ec2,Backend Developer(Python or Java),Success Korea 서울,,"채용제목 Backend Developer( Python or Java) (지원마감) 회사소개 온라인 서비스 업무내용/자격요건 자격요건 - Python, Java, Ruby, Node.js 등을 사용한 3년 이상의 개발 경력..."
https://kr.indeed.com/viewjob?jk=22387439796f984d,"Principal, Quantitative UX Researcher (U...",Coupang 3.0 서울,,"UX우선 순위와 솔루션을 제시 자격 요건: 5년 이상의 데이터 분석 관련 경험 SQL, Excel, Python, R/SAS 등 통계 분석용 소프트웨어 활용 경험 데이터와 인사이트를 시각화하여 간단 명료하게 커뮤니케이..."
https://kr.indeed.com/viewjob?jk=23051a1d08a6ca20,Principal Business Analyst (Global Opera...,Coupang 3.0 서울,,"experience in other data processing and modeling language (R, Python, etc.) Experience to initiate and drive analytics..."
https://kr.indeed.com/viewjob?jk=0775a7b8bbca016c,Senior Server Engineer,레이니스트 서울,,"개발자들에게 코칭 제공 자격 요건 5년 이상 서버 엔지니어링 경험 보유 Golang/Java(Kotlin)/ Python 중 하나 이상에 전문성을 보유, 고도화된 서비스 설계 및 개발 경험 보유 금융관련 IT 업무 경력 보유자..."
https://kr.indeed.com/viewjob?jk=f6e50a2c31a16f79,Imaging Scientist,Success Korea 경기도 화성,,"사용 가능 - OPC, LMC, Tachyon의 DRO 등 - Data analysis : Matlab, Python - Layout handling : Logic Library design 능력 우대 [전형절차] - 1차..."
https://kr.indeed.com/viewjob?jk=1622a08497f8c091,Data Scientist,에너지 거래소 및 에너지데이터 중개 서울,,"금융공학 연구팀과 협업 [자격요건] -유관업무 경력3년 이상 -통계 및 최적화이론, 인공지능모델을 R, Python으로 구현 및 분석 능력 -석사이상 선호 [우대사항] -새로운것을 배우는것에 익숙하며 효율적이며 긍정적인..."
https://kr.indeed.com/viewjob?jk=2d68585432d43fd9,기술적 진단/침해분석(시스템보안),Success Korea 서울,,"니어링, Digital Forensic 경험자 우대 - C, Java, Python 프로그래밍, CISA, CISSP, SIS, PMP 자격증 우대... 우대 - C, Java, Python 프로그래밍, CISA, CISSP..."
https://kr.indeed.com/viewjob?jk=18848cd6c6f44fbe,S/W Engineering Efficiency,Success Korea 성남 분당구,,"학위 또는 이와 동등한 수준의 실무 경험 - Java, C/C++, Python, Go, Haskell과 같은 프로그래밍 언어를 이용한 1년 이상의... 뜨릴 수 있는 분 - Java, Python, Go, Haskell와 같은..."
https://kr.indeed.com/viewjob?jk=d5a08b8f70e8d699,결제시스템 기술개발 (대리-과장),Success Korea 성남 판교역,,"구축개발 및 운영 - 결제 제휴처 개발 및 운영 (1) 개발 경력 요구 사항 * 필수 사항 1. Java, Python 프로그래밍 경력 3년 이상. 2. Spring 프레임워크로 개발 경력 3년 이상 3. Oralce DB..."
https://kr.indeed.com/viewjob?jk=c81984fb6cd9a0c6,빅데이터 전략/마케팅 (과~차장),Success Korea 서울 중구,,"이상 - 전문지식 ※ 통계분석(SAS, R 등) ※ 빅데이터분석 ( Python, Spark, Hadoop, Aster 등) ※ 인공지능, 머신... R 등) ※ 빅데이터분석 ( Python, Spark, Hadoop..."
https://kr.indeed.com/viewjob?jk=1b17d214a0d694f1,머신러닝기반 데이터분석_신입[4차],Success Korea 서울 선릉역,,"알고리즘 및 모델 연구개발 [자격요건] - 대졸 이상 - R 또는 Python을 활용한 데이터 처리 및 분석 프로젝트 경험 - 수학, 통계, 산업공... 자격요건 - 대졸 이상 - R 또는 Python을 활용한 데이터 처리 및..."
https://kr.indeed.com/viewjob?jk=04ecc7af1c61ab5a,통계 분석 전문가,Success Korea 서울 강서구,,"3. 실제 분석 경험 보유해야 함 (SAS, SPSS, or R, PYTHON) 4. 중급 이상을 원하나 초급도 상관없음 5. 빅데이터 인프라 및... SAS, SPSS, or R, PYTHON) 4. 중급 이상을 원하나 초급..."
https://kr.indeed.com/viewjob?jk=52b0b1936e8b4732,모바일게임 서버개발자 모집,Success Korea 성남 서현동,,"및 구성 경험 1년이상: - PHP, Node.js, ASP.NET, Python, Java 언어에 대한 제한은 없음. - HTTP, JSon... Node.js, ASP.NET, Python, Java 언어에 대한 제한은..."
https://kr.indeed.com/viewjob?jk=521e6790bfc52607,제어 엔지니어,Success Korea 성남 중원구,,"중국어 등) - 언어 개발 가능자 (Visual Basic, C#, Python) - 모터 튜닝 가능자 [전형절차] 1차 면접, 2차면접... Visual Basic, C#, Python) - 모터 튜닝 가능자..."
https://kr.indeed.com/viewjob?jk=d24722707c9aed56,빅데이터수집/처리,Success Korea 경기도 성남,,"자격요건] - Java, Scala, Python 사용 가능한 분(택1... 첨부 양식을 반드시 사용) 자격요건 - Java, Scala, Python 사용 가능한 분(택1) - 데이터베이스, 네트워크, 분산처리에 대한..."
https://kr.indeed.com/viewjob?jk=7991847581adc522,데이터분석가,Success Korea 경기도 성남 +1 지역,,"분 - 관련 학과 또는 유관 교육과정 이수자 우대 - 데이터 분석 툴(R, Python등) 활용한 통계 및 Machine learning 가능자 우대... 데이터 분석 툴(R, Python등) 활용한 통계 및 Machine..."
https://kr.indeed.com/viewjob?jk=c0f615c8aecd5778,Deep Learning Engineer(영상 처리),Success Korea 서울,,"resnet, r-cnn 등 주요 모델 지식 보유자 - C++, Python 능숙 사용자 우대사항 - 클라우드 환경 개발 경험 (Open stack... 모델 지식 보유자 - C++, Python 능숙 사용자 우대사항 - 클라..."
https://kr.indeed.com/viewjob?jk=e8d1c3f88e0b200b,Data Scientist,해외송금 전문업체 서울 강남구,,"유지보수 - 데이터 시각화 [ 자격요건 ] - 경력 2~4년차 - SQL 사용이 능숙하신 분(필수) - R, Python 등을 이용한 분석 경험 [ 우대사항 ] - 빅데이터 및 금융데이터 분석 및 예측 - 통계학 전공자..."
https://kr.indeed.com/viewjob?jk=18647b6687b43e04,게임서버 개발,Success Korea 성남 분당구,,"및 배포 시스템 구축과 개선 [자격요건] - Javascript, Python, C# 등을 사용하여 API 서버 개발, 설계가 가능하신 분 (API... 격요건 - Javascript, Python, C# 등을 사용하여 API..."
https://kr.indeed.com/viewjob?jk=2dc48511f09843fa,빅데이터 분석/활용(과~차장),Success Korea 서울,,"이상 - 전문지식 ※ 통계분석(SAS, R 등) ※ 빅데이터분석 ( Python, Spark, Hadoop, Aster 등) ※ 인공지능, 머신... R 등) ※ 빅데이터분석 ( Python, Spark, Hadoop..."
https://kr.indeed.com/viewjob?jk=0fea9598510abf0e,Effect Supervisor (경력 10년 이상) Effect Art...,Mofac 서울 서초구,,"후디니 사용자 – 이펙트 요소 표현에 뛰어난 감각 소유 – VFX 파이프라인에 대한 이해도 우대사항 – Python 등 Scripting 유경험자 – 외국어 가능자 (영어, 중국어) – 경력 5-10년 차 실무경력자 전형절..."
https://kr.indeed.com/viewjob?jk=453d85d6af20f14e,DevOps 엔지니어(과장~차장급),TV홈쇼핑 성남 판교역 +1 지역,,"AWS 경험 2년 이상) - 퍼블릭 클라우드 구축 경험 - 다음 중 하나의 언어를 이용한 업무 자동화 기능 : Python, Node.js, Go - 클라우드 기반 시스템 구축 & 운영 자동화 경험 (Ansible, Chef..."
https://kr.indeed.com/viewjob?jk=c62d380a1585df66,데이터 엔지니어 (3년 이상),우아한 형제들 서울 송파구,,Hadoop/Spark 기반의 빅데이터 인프라 구축 및 ETL 개발 경험(3년 이상) - Scala/Java/ Python 중 1개 이상의 언어 숙련자 - SQL 숙련자(MySQL/SparkSQL) - 1개 이상의 데이터 엔지...
https://kr.indeed.com/viewjob?jk=92ee52d0e9591d5a,통계분석,Success Korea 인천 송도동,,"운영 관련 연구 경력이 있는 분 - SAS 또는 R, SQL, Python 사용 가능자 [공통 지원자격] - TOEIC 750점 또는 TOEIC... SAS 또는 R, SQL, Python 사용 가능자 [공통 지원자격..."
https://kr.indeed.com/viewjob?jk=c67e69651d93a210,모바일 캐쥬얼게임 데이터 분석,Success Korea 성남 분당구,,"능자 [우대사항] - 오픈소스 데이터분석 라이브러리 활용 가능자 ( Python, R 등) - 통계 및 빅데이터 관련 학과 또는 유관 교육 과정 이수... 터분석 라이브러리 활용 가능자 ( Python, R 등) - 통계 및 빅데이..."
https://kr.indeed.com/viewjob?jk=8c651677f4732df6,Blockchain Software Engineer,Success Korea 성남 분당구,,"이를 이용한 서비스 개발에 관심있는 분 - Java / C,C++ / Python 등의 개발 언어를 능숙하게 다루시는 분 - 대용량 트래픽/데이터를... 분 - Java / C,C++ / Python 등의 개발 언어를 능숙하게..."
https://kr.indeed.com/viewjob?jk=eade43a056215708,게임 인공지능(AI),Success Korea 성남 분당구,,"등을 활용한 AI개발 경험이 있으신 분 -C/C++ 혹은 Java, Python 등 프로그래밍 능력이 있으신 분 [우대사항] -Cocos2d-X... 분 -C/C++ 혹은 Java, Python 등 프로그래밍 능력이 있으신..."
https://kr.indeed.com/viewjob?jk=b06176c3a7092e0a,Customer Facing Data Scientist,Ever Better Recruitment (EBR) 서울,,ensure appropriate communication Experience in R or Python analysis Up to 50% off-site visits English ability to perform...
https://kr.indeed.com/viewjob?jk=5e6a30865a5ba13e,서버개발자,Success Korea 성남 판교역,,"유자 - 경력 : 서버 개발경력 5년이상 - Html, JSP, PHP, Python, Javascript, Node.js 등 개발언어 능숙 - 각종... Html, JSP, PHP, Python, Javascript, Node..."
https://kr.indeed.com/viewjob?jk=8b5d08f5b64e487c,블록체인/이머징 핀테크 사업 보안 엔지니어,Success Korea 성남 분당구,,"개발 경험이 있으신 분 - 보안 코드 리뷰 가능하신 분 - Java, Python 등 개발 언어 사용에 익숙하신 분 - 주체적으로 일을 진행하고 리드... 리뷰 가능하신 분 - Java, Python 등 개발 언어 사용에 익숙하신..."
https://kr.indeed.com/viewjob?jk=a3466ccc9a114807,데이터 분석,Success Korea 성남 분당구 +1 지역,,"관련 학과 또는 유관 교육과정을 이수하신 분 -데이터 분석 툴(R, Python등) 활용한 통계 및 Machine learning 가능하신 분 -외국... 분 -데이터 분석 툴(R, Python등) 활용한 통계 및 Machine..."
https://kr.indeed.com/viewjob?jk=29f023eff21a6f01,Cloud Infra Platform Architect (10년 이상),Success Korea 대한민국,,"험자 - IaC, CI/CD 관련 업무 경험자 ( Terraform, Ansible 등 ) - Java, Python, Go 중 한가지 언어를 능숙하게 사용 - Public/Private Cloud Architect 유 경험..."
https://kr.indeed.com/viewjob?jk=528f6bfd19115fe1,웹개발자,매장공유기 서비스 서울,,"[담당 업무] -node.js/ python/react.js... 개발팀 사용 스펙(AWS, Typescript , node.js, python, mongo db, Linux)을 사용할 줄 아는 분 - 네트워크에..."
https://kr.indeed.com/viewjob?jk=9681ee519a4f870e,게임밸런스 (게임 시뮬레이터),Success Korea 성남 분당구,,프로그램 개발 경력 3년 이상이신 분 (언어 불문) -Scala 혹은 Python 등 새로운 언어의 학습 의지가 있으신 분 -숫자에 대한 감각이 있으... 언어 불문) -Scala 혹은 Python 등 새로운 언어의 학습 의지가...
https://kr.indeed.com/viewjob?jk=a905667ba592d1b2,Data Center Techinician,Amzn Corporate Services Korea 서울,,"vendors · Scripting skills - Bash, Python, Perl, etc. · Project coordination... 스크립팅 기술 - Bash, Python, Perl 등 보유자 · 프로젝트..."
https://kr.indeed.com/viewjob?jk=2cca42ee0951d4be,"Principal, Business Analysis (Coupang Ea...",Coupang 3.0 서울,,"SQL, Excel, Python, and R/SAS or any... 경영학 학사 혹은 해당 분야에서 그에 준하는 경험 SQL, Excel, Python, R/SAS 등 통계 분석용 소프트웨어 활용 경험 Hadoop..."
https://kr.indeed.com/viewjob?jk=736c75e6528f5bb4,보안 엔지니어,Success Korea 성남 분당구,,"코드 리뷰 가능하신 분 - 보안 기술 연구 가능하신 분 - Java, Python 등 개발 언어 사용에 익숙하신 분 - 주체적으로 일을 진행하고 리드... 연구 가능하신 분 - Java, Python 등 개발 언어 사용에 익숙하신..."
https://kr.indeed.com/viewjob?jk=54a07508e05274ad,게임플랫폼 서버개발,Success Korea 성남 서현역,,"scala (이외 C++, Go, Python 등)을 이용한 서버 개발... 이력서 자격요건 - Java / scala (이외 C++, Go, Python 등)을 이용한 서버 개발 경력 3년 이상 - 오픈소스 기술을 바탕..."
https://kr.indeed.com/viewjob?jk=350b7411f2bc04e6,Full Stack Developer (Internal Products),비바리퍼블리카 서울 강남구,,체화할 수 있는 분 우대 사항 Python/Django 기반의 서비스 개발... 터넷·IT·통신·모바일·게임>웹프로그래머> Python|인터넷·IT·통신·모바일·게임>응용프로그래머> Python|인터넷·IT·통신·모바일·게임>응용프로...
https://kr.indeed.com/viewjob?jk=2755f5a6205a5c3d,프론트앤드 개발,Nexon 성남 분당구,,"UX에 대한 지속적인 관심 - 더 나은 코드를 위해 노력하시는 분 - Spring, Node.js, Python 등 한 가지 이상의 백엔드 기술에 대한 이해 - TypeScript 경험자 우대 - 프로젝트 설정부터..."
https://kr.indeed.com/viewjob?jk=158d61f253f65fb4,2020년 하반기 각 부문 신입/경력,스탠드포인트 서울 금천구,,년 이상 ㆍ직급/직책 : 팀장/파트장급 ㆍPHP / JAVA / Python 언어 중 한가지 이상의 언어를 능숙히 사용하시는 분 ㆍAWS(Amazon... Laravel(PHP7+) / Python / Linux / MySQL...
https://kr.indeed.com/viewjob?jk=ae2c6294bc277408,Lead Technical Solutions Engineer,MightyHive 서울,,Data Analysis in Python... R Machine... 와 같은 모바일 앱 트래킹 도구들을 위한 모바일 이벤트 트래킹 Python 또는 R 을 활용한 데이터 분석 Machine Learning...
https://kr.indeed.com/viewjob?jk=241ae1e7499c461c,Security Engineer (모의해킹/취약점 점검),Toss 서울 강남구,,"그바운트 경험이 있는 분 - 해킹대회 우승 경력이 있는 분 - 다양한 플랫폼 보안 진단 경험이 있는 분 - Python, C, C++, C#, JAVA 중 프로그래밍 언어에 능숙 하신 분 # 현업 인터뷰 - 결제 산업의 미래..."
https://kr.indeed.com/viewjob?jk=bf8af6c190715196,"딥러닝, 빅데이터 외 신입/경력 계약직",서울대학교병원 서울 종로구,,공지능)>빅데이터|인터넷·IT·통신·모바일·게임>빅데이터·AI(인공지능)>데이터분석|인터넷·IT·통신·모바일·게임>빅데이터·AI(인공지능)> Python|인터넷·IT·통신·모바일·게임>빅데이터·AI(인공지능)>하둡(Hadoop)
https://kr.indeed.com/viewjob?jk=419692b3ddb34768,Analytics Specialist,MightyHive 서울,,"end languages ( Python, NodeJS, PHP, etc... HTML5 / CSS / JavaScript, 기타 프론트 엔드 언어 ( Python, NodeJS, PHP 등)에 대한 read/write 능력..."
https://kr.indeed.com/viewjob?jk=fbaef889d327803a,경력사원 [Data Scientist],S-OIL 서울 마포구,,"머신러닝 등을 활용한 Big Data 모델링 분석 수행 경력 (5년 이상) ㆍ통계 프로그램(R, Python 등) 활용 능력 (상급 level) ㆍ고급 데이터 분석 실무 경험 보유 (Data Mining, Machine..."
https://kr.indeed.com/viewjob?jk=d23d72ee0fe77d28,청년 디지털 일자리 참여 대상[웹 개발자(Python)],에잇퍼센트 서울 영등포구,"연봉 24,000,000원","모집직종, 모집인원, 학력, 전공, 고용형태, 근무예정지, 인근지하철, 직무내용, 경력조건, 필요경력, 자격면허, 병역, 병역특례, 외국어 능력, 컴퓨터 활용, 채용가능 장애유형, 장려금 지급 대상자 채용희망 등 구인정보..."
https://kr.indeed.com/viewjob?jk=d4c52ba1a491a8b9,현대무벡스 경력사원 상시,현대무벡스 서울 종로구,,PM>웹기획|인터넷·IT·통신·모바일·게임>웹프로그래머>JAVA|인터넷·IT·통신·모바일·게임>웹프로그래머> Python|인터넷·IT·통신·모바일·게임>네트워크·서버·보안>정보보안|인터넷·IT·통신·모바일·게임>응용프로그래머>클라우드
https://kr.indeed.com/viewjob?jk=7b6760541b9d916c,[신규 프로젝트][Project TL] MMORPG 클라이언트 프로그래머...,엔씨소프트 2.7 성남 판교역,,"개발 경험 우대사항 - Unreal Engine 에 대한 이해 - 블루프린트, UMG 에 대한 이해 - Python, Design Pattern, 게임 수학 제출서류 포트폴리오(선택사항) 전형단계 서류전형 1차 면접 NC..."
https://kr.indeed.com/viewjob?jk=a84b5655343a0228,DRX 인재 공개,디알엑스 서울 구로구,,"방안 수립 ㆍ데이터 모델/알고리즘 설계, 개발 및 정리 필수사항 ㆍ데이터 분석 관련 경력 2년 이상 ㆍR, Python, SQL, Excel 등을 이용한 프로그램 개발 능력자 ㆍ기계 학습 모델 실무 또는 프로젝트 경험 1년..."
https://kr.indeed.com/viewjob?jk=7c4d8d6a7ed62979,[TmaxTibero/기술] DBMS 제품 QA 신입 및 경력,티맥스소프트 성남 분당구,,"스트 시나리오 기획/작성, 테스트 및 관리 - 품질관리 시스템 개발 및 유지보수 자격요건 - Java/C/ Python 초급 개발자/경험자 - Unix/Linux 엔지니어 경험자 - IT 관련 학과 4년 대졸자 또는 졸업 예정..."
https://kr.indeed.com/viewjob?jk=269ce808b8a75923,[신입/정규] 광고 솔루션 개발 (Python),니트머스 서울 중구,"연봉 25,000,000원 - 30,000,000원","Python) 모집 모집부문 및 자격요건(""청년 디지털 일자리 사업"" 참여 중) 담당업무 자격요건 인원 [담당업무] 광고 솔루션 개발 ( python... 소될 수 있습니다. 인터넷·IT·통신·모바일·게임>웹프로그래머> Python"
https://kr.indeed.com/viewjob?jk=9d78b4ee5fde16b1,[단기계약직] 인공지능 기술 개발을 위한 언어 데이터 구축자 모집,엔씨소프트 2.7 성남 판교역,,언어 데이터를 꼼꼼하게 분석하고 정리할 수 있으신 분 - 언어자원 구축 경험이 있으신 분. - 엑셀 또는 Python 등의 프로그래밍 언어로 데이터 처리가 가능하신 분 (필수사항 아님) 제출서류 필수 제출서류 없음 전형단계...
https://kr.indeed.com/viewjob?jk=f8e05e47f5c95354,대용량 분산 스토리지 개발자 모집,카카오 4.0 성남 판교역,,반의 프로그래밍에 익숙하신 분 우대 자격 Java 멀티쓰레드 기반 네트워크 프로그래밍 경험이 있으신 분 Python 등의 스크립트 언어를 하나 이상 다룰 수 있으신 분 HBase 등의 NoSQL 시스템 운영이나 사용 경험...
https://kr.indeed.com/viewjob?jk=97518f4ddf1027a2,Business Analyst,Procter & Gamble 4.2 서울,,"any... followings: programming / database languages (e.g. Python, R, SQL), visualization tools (e.g. Power BI, Spotfire..."
https://kr.indeed.com/viewjob?jk=5cb14c0712a6c4c1,시스템 엔지니어링,NHN 4.4 성남 판교역,,"Windows OS 스킬 보유 및 X86 서버 운영 경험 보유 - 기본적인 운영도구 개발 가능자 * Python, Django, JAVA - 웹 서비스 또는 플랫폼 개발 경력 보유자 - OpenStack 기반의..."
https://kr.indeed.com/viewjob?jk=32644ae8c4d5d354,데이터분석가 신입/경력,네모파트너즈비에이 서울 영등포구,,"사항: 대학교(4년)졸업 이상 - 직무기술: 빅데이터, 데이터분석, Python, SAS, 시스템개발, 빅데이터분석 및 AI개발 [우대사항] - 컴퓨... 게임>빅데이터·AI(인공지능)> Python|인터넷·IT·통신·모바일·게임..."
https://kr.indeed.com/viewjob?jk=feac8a234b715106,네이버 일본 맛집 서비스 CONOMI 머신러닝 개발자,네이버 서울,,"2 년 이상 ) - 컴퓨터 관련 전공자 수준의 프로그래밍 역량 (Linux/Shell, C++, Python, TensorFlow, PyTorch 등 ) - Production level 의 machine learning..."
https://kr.indeed.com/viewjob?jk=5123207a169f90eb,Software Developer - Front-End / Back-En...,AITRICS 서울,,"purpose programming languages including C++, Java, Javascript, Python. Eager to learn a new programming language and machine..."
https://kr.indeed.com/viewjob?jk=bf96469e42173064,2020년 경력사원 상시,코리아크레딧뷰로 서울 종로구,,통계·SAS|마케팅·광고·홍보·조사>조사·분석·통계>시장조사·분석|인터넷·IT·통신·모바일·게임>웹프로그래머> Python|인터넷·IT·통신·모바일·게임>웹프로그래머>JAVA|인터넷·IT·통신·모바일·게임>웹프로그래머>HTML...
https://kr.indeed.com/viewjob?jk=76730b837fd4d4d7,Support Engineer _ Azure PaaS,Microsoft 4.2 서울,,"Java, Node, Python, PHP and Ruby, .NET... Linux, NGNIX, Apache, Java, Node, Python, PHP and Ruby • Experience with customer..."
https://kr.indeed.com/viewjob?jk=1b94c21eea347b4d,Data Center Operations Engineer,Amzn Corporate Services Korea 서울,,"vendors · Scripting skills - Bash, Python, Perl, etc. · Project coordination... 스크립팅 기술 - Bash, Python, Perl 등 보유자 · 프로젝트..."
https://kr.indeed.com/viewjob?jk=934bcac6e0765bb9,Solutions Architect,NVIDIA 서울,,"Computer Engineering. Work or research experience with Python, C/C++ software development. A proven track record of academic..."
https://kr.indeed.com/viewjob?jk=ac3939eb43b8729c,Marketing Data Analyst,하이퍼커넥트 서울,,"서비스 회사에서의 데이터 분석 경험 가설을 세우고 데이터로 증명하기 위한 논리적 사고 능력 우대사항 Python 또는 R 활용 역량 보유 데이터마이닝, 머신러닝, 통계 관련 역량 보유 퍼포먼스 마케팅에 대한 이해 채용형..."
https://kr.indeed.com/viewjob?jk=9d9f5827c98272c9,테크빌더팀 웹어플리케이션 개발자 (백앤드/프론트앤드),Nexon 성남 분당구,,"주요업무 - 유저동향분석 시스템, 개발팀 지원 서비스 운영 및 개발 사용언어 및 라이브러리 - Python + Flask - JavaScript, React, Angular, JQuery - Elastic Search..."
https://kr.indeed.com/viewjob?jk=155fdbd50a388624,ICT이노베이션스퀘어 AI 인공지능/블록체인 교육,전라남도정보문화산업진흥원 전라남도 무안,,인공지능(AI)|인터넷·IT·통신·모바일·게임>빅데이터·AI(인공지능)>빅데이터|인터넷·IT·통신·모바일·게임>빅데이터·AI(인공지능)>공간빅데이터전문가|인터넷·IT·통신·모바일·게임>빅데이터·AI(인공지능)> Python
https://kr.indeed.com/viewjob?jk=3acc6a96f44da5fc,Python 백엔드 개발자 3년이상,한국 최대의 플라워 브랜드 서울 서초구,,"하실수 있기를 기대합니다. Python 백엔드 개발자 3년이상 • 회사... Django, Python) - 신규 서비스 설계부터 오픈후 유지보수 - MySQL 쿼리 사용하여 데이터 추출 • 필수자격요건 - Python 개발..."
https://kr.indeed.com/viewjob?jk=a50fce6cc2cb57c9,자연어처리전문가 금융챗봇 만들어 갈 엔지니어,파운트 서울 충정로역,,리에 필요한 알고리즘을 개발하고 Python으로 구현 및 성능 검증을 진행... Description - 자연어 처리에 필요한 알고리즘을 개발하고 Python으로 구현 및 성능 검증을 진행 - 자연어 전처리 (형태소 분석...
https://kr.indeed.com/viewjob?jk=7af6301dc691d3ab,Data Scientist,Toss 서울 강남구,,"실무 경험 5년 이상 갖추신 분 - 실제 서비스 데이터를 이용한 분석모델 개발 경험이 있으신 분 - R, Python, Scala, SQL 등 데이터 분석의 업무를 수행할 수 있는 하나 이상의 개발 언어에 능숙하신 분 #..."
https://kr.indeed.com/viewjob?jk=b7be58e7af38d186,Developer (개발자),Coinplug 경기도 성남,,"Azure 등 Cloud 환경에서 빌드, 배포, 모니터링 등의 경험이 있으신 분 서버 개발 [우대사항] Python / Node.js / Go / Java 중 한 가지 이상의 개발 언어에 익숙하신 분 Restful API..."
https://kr.indeed.com/viewjob?jk=52ad14e8b9a390ac,[시스템팀] 시스템엔지니어,심플렉스 서울 목동,,"DNS, IIS 등) 기본 지식 - script(bash, perl, python, powershell 등)에 대한 이해 또는 개발 역량 - 시스템... 경험 - bash, perl, python, powershell 스크립트..."
https://kr.indeed.com/viewjob?jk=741cc6ac364ea9be,Internal Infra Engineer,Toss 서울 강남구,,분 # 우대 사항 - Nutanix/VMWare 구축 운영 경험이 있으신 분 - Powershell 또는 Python 등을 사용한 시스템 관리 자동화 경험이 있으신 분 - 100명 이상 규모의 L3/L4 네트워크 관리 또는...
https://kr.indeed.com/viewjob?jk=8f14ff060ef31f52,"펌웨어·어셈블러, 임베디드(Embedded) 외 신입/경력 정규직",프라임제이이앤씨 대전 유성구,"연봉 25,000,000원 - 30,000,000원",인공지능)>빅데이터|인터넷·IT·통신·모바일·게임>빅데이터·AI(인공지능)>인공지능(AI)|인터넷·IT·통신·모바일·게임>빅데이터·AI(인공지능)>데이터분석|인터넷·IT·통신·모바일·게임>빅데이터·AI(인공지능)> Python
https://kr.indeed.com/viewjob?jk=7d29efdc2b4eafe8,[인턴] Lighthouse 본부 - 머신러닝 서비스 개발자 인턴,삼정 KPMG 3.3 서울 강남구,,"모형 개발과 배포, Restful API 개발 능력 보유 - 리눅스 및 Docker 환경에서의 개발 경험 - Python Web Framework (Django/Flask) 혹은 R Shiny 모듈 경험 - 딥러닝 전이학습..."
